genres,id,original_title,overview,popularity,poster_path,production_companies,release_date,tagline,title,vote_average,vote_count,genres_clean,companies_text,content
action adventure,1408,cutthroat island,"morgan adams and her slave, william shaw, are on a quest to recover the three portions of a treasure map. unfortunately, the final portion is held by her murderous uncle, dawg. her crew is skeptical of her leadership abilities, so she must complete her quest before they mutiny against her. this is made yet more difficult by the efforts of the british crown to end her pirate raids.",7.284477,/hYdeBZ4BFXivdouxLfQGWNE6zRx.jpg,"[{'name': 'Le Studio Canal+', 'id': 183}, {'name': 'Laurence Mark Productions', 'id': 415}, {'name': 'Metro-Goldwyn-Mayer (MGM)', 'id': 8411}, {'name': 'Carolco Pictures', 'id': 14723}]",1995-12-22,the course has been set. there is no turning back. prepare your weapons. summon your courage. discover the adventure of a lifetime!,cutthroat island,5.7,137.0,"['Action', 'Adventure']",le studio canal+ laurence mark productions metro-goldwyn-mayer (mgm) carolco pictures,"cutthroat island action adventure morgan adams and her slave, william shaw, are on a quest to recover the three portions of a treasure map. unfortunately, the final portion is held by her murderous uncle, dawg. her crew is skeptical of her leadership abilities, so she must complete her quest before they mutiny against her. this is made yet more difficult by the efforts of the british crown to end her pirate raids. the course has been set. there is no turning back. prepare your weapons. summon your courage. discover the adventure of a lifetime! le studio canal+ laurence mark productions metro-goldwyn-mayer (mgm) carolco pictures"
crime comedy,5,four rooms,it's ted the bellhop's first night on the job...and the hotel's very unusual guests are about to place him in some outrageous predicaments. it seems that this evening's room service is serving up one unbelievable happening after another.,9.026586,/75aHn1NOYXh4M7L5shoeQ6NGykP.jpg,"[{'name': 'Miramax Films', 'id': 14}, {'name': 'A Band Apart', 'id': 59}]",1995-12-09,"twelve outrageous guests. four scandalous requests. and one lone bellhop, in his first day on the job, who's in for the wildest new year's eve of his life.",four rooms,6.5,539.0,"['Comedy', 'Crime']",miramax films a band apart,"four rooms crime comedy it's ted the bellhop's first night on the job...and the hotel's very unusual guests are about to place him in some outrageous predicaments. it seems that this evening's room service is serving up one unbelievable happening after another. twelve outrageous guests. four scandalous requests. and one lone bellhop, in his first day on the job, who's in for the wildest new year's eve of his life. miramax films a band apart"
fantasy science fiction adventure,902,la cité des enfants perdus,"a scientist in a surrealist society kidnaps children to steal their dreams, hoping that they slow his aging process.",9.822423,/whwT3Q9JxbAYzEc3t7uYYcCbTMf.jpg,"[{'name': 'Procirep', 'id': 311}, {'name': 'Constellation Productions', 'id': 590}, {'name': 'France 3 Cinéma', 'id': 591}, {'name': 'Claudie Ossard Productions', 'id': 592}, {'name': 'Eurimages', 'id': 850}, {'name': 'MEDIA Programme of the European Union', 'id': 851}, {'name': 'Cofimage 5', 'id': 1871}, {'name': 'Televisión Española (TVE)', 'id': 6639}, {'name': 'Tele München Fernseh Produktionsgesellschaft (TMG)', 'id': 7237}, {'name': ""Club d'Investissement Média"", 'id': 8170}, {'name': 'Canal+ España', 'id': 9335}, {'name': 'Elías Querejeta Producciones Cinematográficas S.L.', 'id': 12009}, {'name': 'Centre National de la Cinématographie (CNC)', 'id': 18367}, {'name': 'Victoires Productions', 'id': 25020}, {'name': 'Constellation', 'id': 25021}, {'name': 'Lumière Pictures', 'id': 25129}, {'name': 'Canal+', 'id': 47532}, {'name': 'Studio Image', 'id': 68517}, {'name': 'Cofimage 4', 'id': 79437}, {'name': 'Ossane', 'id': 79438}, {'name': 'Phoenix Images', 'id': 79439}]",1995-05-16,where happily ever after is just a dream.,the city of lost children,7.6,308.0,"['Fantasy', 'Science Fiction', 'Adventure']",procirep constellation productions france 3 cinéma claudie ossard productions eurimages media programme of the european union cofimage 5 televisión española (tve) tele münchen fernseh produktionsgesellschaft (tmg) club d'investissement média canal+ españa elías querejeta producciones cinematográficas s.l. centre national de la cinématographie (cnc) victoires productions constellation lumière pictures canal+ studio image cofimage 4 ossane phoenix images,"the city of lost children fantasy science fiction adventure a scientist in a surrealist society kidnaps children to steal their dreams, hoping that they slow his aging process. where happily ever after is just a dream. procirep constellation productions france 3 cinéma claudie ossard productions eurimages media programme of the european union cofimage 5 televisión española (tve) tele münchen fernseh produktionsgesellschaft (tmg) club d'investissement média canal+ españa elías querejeta producciones cinematográficas s.l. centre national de la cinématographie (cnc) victoires productions constellation lumière pictures canal+ studio image cofimage 4 ossane phoenix images"
music drama family,2054,mr. holland's opus,"in 1965, passionate musician glenn holland takes a day job as a high school music teacher, convinced it's just a small obstacle on the road to his true calling: writing a historic opus. as the decades roll by with the composition unwritten but generations of students inspired through his teaching, holland must redefine his life's purpose.",7.137117,/kBmwWeSN3ajnYHZ3dSybEobxEPI.jpg,"[{'name': 'Hollywood Pictures', 'id': 915}, {'name': 'The Charlie Mopic Company', 'id': 916}, {'name': 'PolyGram Filmed Entertainment', 'id': 1382}, {'name': 'Interscope Communications', 'id': 10201}]",1995-12-29,"of all the lives he changed, the one that changed the most was his own.",mr. holland's opus,6.9,115.0,"['Drama', 'Music', 'Family']",hollywood pictures the charlie mopic company polygram filmed entertainment interscope communications,"mr. holland's opus music drama family in 1965, passionate musician glenn holland takes a day job as a high school music teacher, convinced it's just a small obstacle on the road to his true calling: writing a historic opus. as the decades roll by with the composition unwritten but generations of students inspired through his teaching, holland must redefine his life's purpose. of all the lives he changed, the one that changed the most was his own. hollywood pictures the charlie mopic company polygram filmed entertainment interscope communications"
romance drama comedy,1909,don juan demarco,"john arnold demarco is a man who believes he is don juan, the greatest lover in the world. clad in a cape and mask, demarco undergoes psychiatric treatment with dr. jack mickler to cure him of his apparent delusion. but the psychiatric sessions have an unexpected effect on the psychiatric staff and, most profoundly, dr mickler, who rekindles the romance in his complacent marriage.",7.438934,/fe0TuYz9jCKUba2Omj48K8bWJ8z.jpg,"[{'name': 'New Line Cinema', 'id': 12}, {'name': 'American Zoetrope', 'id': 70}]",1994-10-01,the story of the man who thought he was the greatest lover in the world... and the people who tried to cure him of it!,don juan demarco,6.3,184.0,"['Drama', 'Comedy', 'Romance']",new line cinema american zoetrope,"don juan demarco romance drama comedy john arnold demarco is a man who believes he is don juan, the greatest lover in the world. clad in a cape and mask, demarco undergoes psychiatric treatment with dr. jack mickler to cure him of his apparent delusion. but the psychiatric sessions have an unexpected effect on the psychiatric staff and, most profoundly, dr mickler, who rekindles the romance in his complacent marriage. the story of the man who thought he was the greatest lover in the world... and the people who tried to cure him of it! new line cinema american zoetrope"
horror romance,628,interview with the vampire,"a vampire relates his epic life story of love, betrayal, loneliness, and dark hunger to an over-curious reporter.",11.970205,/2162lAT2MP36MyJd2sttmj5du5T.jpg,"[{'name': 'Geffen Pictures', 'id': 360}]",1994-11-11,drink from me and live forever,interview with the vampire,7.2,1558.0,"['Horror', 'Romance']",geffen pictures,"interview with the vampire horror romance a vampire relates his epic life story of love, betrayal, loneliness, and dark hunger to an over-curious reporter. drink from me and live forever geffen pictures"
adventure action science fiction,11,star wars,princess leia is captured and held hostage by the evil imperial forces in their effort to take over the galactic empire. venturesome luke skywalker and dashing captain han solo team together with the loveable robot duo r2-d2 and c-3po to rescue the beautiful princess and restore peace and justice in the empire.,42.149697,/6FfCtAuVAW8XJjZ7eWeLibRLWTw.jpg,"[{'name': 'Lucasfilm', 'id': 1}, {'name': 'Twentieth Century Fox Film Corporation', 'id': 306}]",1977-05-25,"a long time ago in a galaxy far, far away...",star wars,8.1,6778.0,"['Action', 'Science Fiction', 'Adventure']",lucasfilm twentieth century fox film corporation,"star wars adventure action science fiction princess leia is captured and held hostage by the evil imperial forces in their effort to take over the galactic empire. venturesome luke skywalker and dashing captain han solo team together with the loveable robot duo r2-d2 and c-3po to rescue the beautiful princess and restore peace and justice in the empire. a long time ago in a galaxy far, far away... lucasfilm twentieth century fox film corporation"
drama,527,once were warriors,"a drama about a maori family lving in auckland, new zealand. lee tamahori tells the story of beth heke’s strong will to keep her family together during times of unemployment and abuse from her violent and alcoholic husband.",4.025276,/1nd4SsytVc96hy92g8NNVPD3mzf.jpg,"[{'name': 'Avalon Studios', 'id': 293}, {'name': 'New Zealand Film Commission', 'id': 294}, {'name': 'New Zealand On Air', 'id': 295}]",1994-09-02,"a family in crisis, a life in chaos... nothing is more powerful than a mother's love.",once were warriors,7.6,106.0,['Drama'],avalon studios new zealand film commission new zealand on air,"once were warriors drama a drama about a maori family lving in auckland, new zealand. lee tamahori tells the story of beth heke’s strong will to keep her family together during times of unemployment and abuse from her violent and alcoholic husband. a family in crisis, a life in chaos... nothing is more powerful than a mother's love. avalon studios new zealand film commission new zealand on air"
drama mystery romance,110,trois couleurs : rouge,red this is the third film from the trilogy by kieślowski. “red” meaning brotherliness. here kieślowski masterly tells strange coincidentally linked stories in the most packed work.,7.832755,/JHmsBiX1tjCKqAul1lzC20WcAW.jpg,"[{'name': 'Zespół Filmowy TOR', 'id': 38}, {'name': 'Le Studio Canal+', 'id': 183}, {'name': 'France 3 Cinéma', 'id': 591}, {'name': 'Télévision Suisse-Romande', 'id': 1245}]",1994-05-27,,three colors: red,7.8,246.0,"['Drama', 'Romance', 'Mystery']",zespół filmowy tor le studio canal+ france 3 cinéma télévision suisse-romande,three colors: red drama mystery romance red this is the third film from the trilogy by kieślowski. “red” meaning brotherliness. here kieślowski masterly tells strange coincidentally linked stories in the most packed work.  zespół filmowy tor le studio canal+ france 3 cinéma télévision suisse-romande
science fiction action adventure thriller,193,star trek: generations,captain jean-luc picard and the crew of the enterprise-d find themselves at odds with the renegade scientist soran who is destroying entire star systems. only one man can help picard stop soran's scheme...and he's been dead for seventy-eight years.,8.105708,/gh0ZZRwSmlzEZTIZee3ZCN9Jssx.jpg,"[{'name': 'Paramount Pictures', 'id': 4}]",1994-11-17,boldly go.,star trek: generations,6.4,461.0,"['Thriller', 'Action', 'Science Fiction', 'Adventure']",paramount pictures,star trek: generations science fiction action adventure thriller captain jean-luc picard and the crew of the enterprise-d find themselves at odds with the renegade scientist soran who is destroying entire star systems. only one man can help picard stop soran's scheme...and he's been dead for seventy-eight years. boldly go. paramount pictures
comedy drama romance,2064,while you were sleeping,"a love story built on a misunderstanding. a transit worker pulls commuter peter off the tracks after he's mugged. but while he's in a coma, his family mistakenly thinks she's peter's fiancée, and she doesn't correct them. things get more complicated when she falls for his brother, who's not quite sure that she's who she claims to be.",15.783615,/qNGO3ETcNwlWqK2kNRpbJSJRlos.jpg,"[{'name': 'Caravan Pictures', 'id': 175}, {'name': 'Hollywood Pictures', 'id': 915}]",1995-04-21,a story about love at second sight.,while you were sleeping,6.5,340.0,"['Drama', 'Comedy', 'Romance']",caravan pictures hollywood pictures,"while you were sleeping comedy drama romance a love story built on a misunderstanding. a transit worker pulls commuter peter off the tracks after he's mugged. but while he's in a coma, his family mistakenly thinks she's peter's fiancée, and she doesn't correct them. things get more complicated when she falls for his brother, who's not quite sure that she's who she claims to be. a story about love at second sight. caravan pictures hollywood pictures"
drama comedy romance,236,muriel's wedding,"muriel’s wedding is p.j. hogan’s film debut. a humorous emancipation story of an unemployed woman who evolves from a dreamer into a self sustaining successful woman. an amusing comedy that’s funny, silly, angry and serious.",5.254847,/zJyTr8Fo412a2OIfJGXTRAm4IwX.jpg,"[{'name': 'Ciby 2000', 'id': 105}, {'name': 'Film Victoria', 'id': 11840}, {'name': 'House & Moorhouse Films', 'id': 39250}]",1994-09-29,success is the best revenge.,muriel's wedding,6.9,104.0,"['Drama', 'Comedy', 'Romance']",ciby 2000 film victoria house & moorhouse films,"muriel's wedding drama comedy romance muriel’s wedding is p.j. hogan’s film debut. a humorous emancipation story of an unemployed woman who evolves from a dreamer into a self sustaining successful woman. an amusing comedy that’s funny, silly, angry and serious. success is the best revenge. ciby 2000 film victoria house & moorhouse films"
action crime,315,"faster, pussycat! kill! kill!","three strippers seeking thrills encounter a young couple in the desert. after dispatching the boyfriend, they take the girl hostage and begin scheming on a crippled old man living with his two sons in the desert, reputedly hiding a tidy sum of cash. they become house guests of the old man and try and seduce the sons in an attempt to locate the money, not realizing that the old man has a few sinister intentions of his own.",4.220541,/2hIHFk52SZ9XsZB4U85RUq36BT4.jpg,"[{'name': 'Eve Productions Inc.', 'id': 170}]",1965-08-06,go-go for a wild ride with the action girls!,"faster, pussycat! kill! kill!",6.5,59.0,"['Crime', 'Action']",eve productions inc.,"faster, pussycat! kill! kill! action crime three strippers seeking thrills encounter a young couple in the desert. after dispatching the boyfriend, they take the girl hostage and begin scheming on a crippled old man living with his two sons in the desert, reputedly hiding a tidy sum of cash. they become house guests of the old man and try and seduce the sons in an attempt to locate the money, not realizing that the old man has a few sinister intentions of his own. go-go for a wild ride with the action girls! eve productions inc."
drama action thriller,2087,the getaway,"doc mccoy is put in prison because his partners chickened out and flew off without him after exchanging a prisoner with a lot of money. doc knows jack benyon, a rich ""business""-man, is up to something big, so he tells his wife (carol mccoy) to tell him that he's for sale if benyon can get him out of prison. benyon pulls some strings and doc mccoy is released again. unfortunately he has to cooperate with the same person that got him to prison.",14.214403,/ftbdJTJi6mR5iZV5ESJWv8f8pWN.jpg,"[{'name': 'Universal Pictures', 'id': 33}, {'name': 'Largo Entertainment', 'id': 1644}]",1994-02-11,,the getaway,5.4,81.0,"['Thriller', 'Drama', 'Action']",universal pictures largo entertainment,"the getaway drama action thriller doc mccoy is put in prison because his partners chickened out and flew off without him after exchanging a prisoner with a lot of money. doc knows jack benyon, a rich ""business""-man, is up to something big, so he tells his wife (carol mccoy) to tell him that he's for sale if benyon can get him out of prison. benyon pulls some strings and doc mccoy is released again. unfortunately he has to cooperate with the same person that got him to prison.  universal pictures largo entertainment"
action adventure crime thriller,2019,hard target,"when a woman's father goes missing, she enlist a local to aid in her search.  the pair soon discover that her father has died at the hands of a wealthy sportsman who hunts homeless men as a form of recreation.",7.834351,/mXCM7pmUFUGp7QzSmare3RITe6n.jpg,"[{'name': 'Universal Pictures', 'id': 33}, {'name': 'Renaissance Pictures', 'id': 467}, {'name': 'Alphaville Films', 'id': 11462}]",1993-08-20,don't hunt what you can't kill.,hard target,6.1,237.0,"['Thriller', 'Crime', 'Action', 'Adventure']",universal pictures renaissance pictures alphaville films,"hard target action adventure crime thriller when a woman's father goes missing, she enlist a local to aid in her search.  the pair soon discover that her father has died at the hands of a wealthy sportsman who hunts homeless men as a form of recreation. don't hunt what you can't kill. universal pictures renaissance pictures alphaville films"
action thriller crime,6,judgment night,"while racing to a boxing match, frank, mike, john and rey get more than they bargained for. a wrong turn lands them directly in the path of fallon, a vicious, wise-cracking drug lord. after accidentally witnessing fallon murder a disloyal henchman, the four become his unwilling prey in a savage game of cat &amp; mouse as they are mercilessly stalked through the urban jungle in this taut suspense drama",5.538671,/3rvvpS9YPM5HB2f4HYiNiJVtdam.jpg,"[{'name': 'Universal Pictures', 'id': 33}, {'name': 'Largo Entertainment', 'id': 1644}, {'name': 'JVC Entertainment Networks', 'id': 4248}]",1993-10-15,don't move. don't whisper. don't even breathe.,judgment night,6.4,79.0,"['Thriller', 'Crime', 'Action']",universal pictures largo entertainment jvc entertainment networks,"judgment night action thriller crime while racing to a boxing match, frank, mike, john and rey get more than they bargained for. a wrong turn lands them directly in the path of fallon, a vicious, wise-cracking drug lord. after accidentally witnessing fallon murder a disloyal henchman, the four become his unwilling prey in a savage game of cat &amp; mouse as they are mercilessly stalked through the urban jungle in this taut suspense drama don't move. don't whisper. don't even breathe. universal pictures largo entertainment jvc entertainment networks"
adventure science fiction,329,jurassic park,"a wealthy entrepreneur secretly creates a theme park featuring living dinosaurs drawn from prehistoric dna. before opening day, he invites a team of experts and his two eager grandchildren to experience the park and help calm anxious investors. however, the park is anything but amusing as the security systems go off-line and the dinosaurs escape.",8.863776,/bRKmwU9eXZI5dKT11Zx1KsayiLW.jpg,"[{'name': 'Universal Pictures', 'id': 33}, {'name': 'Amblin Entertainment', 'id': 56}]",1993-06-11,an adventure 65 million years in the making.,jurassic park,7.6,4956.0,"['Science Fiction', 'Adventure']",universal pictures amblin entertainment,"jurassic park adventure science fiction a wealthy entrepreneur secretly creates a theme park featuring living dinosaurs drawn from prehistoric dna. before opening day, he invites a team of experts and his two eager grandchildren to experience the park and help calm anxious investors. however, the park is anything but amusing as the security systems go off-line and the dinosaurs escape. an adventure 65 million years in the making. universal pictures amblin entertainment"
comedy drama family,788,mrs. doubtfire,"loving but irresponsible dad daniel hillard, estranged from his exasperated spouse, is crushed by a court order allowing only weekly visits with his kids. when daniel learns his ex needs a housekeeper, he gets the job -- disguised as an english nanny. soon he becomes not only his children's best pal but the kind of parent he should have been from the start.",11.16553,/shHrSmXS5140o6sQzgzXxn3KqSm.jpg,"[{'name': 'Twentieth Century Fox Film Corporation', 'id': 306}, {'name': 'Blue Wolf', 'id': 10230}]",1993-11-24,she makes dinner. she does windows. she reads bedtime stories. she's a blessing... in disguise.,mrs. doubtfire,7.0,1638.0,"['Drama', 'Comedy', 'Family']",twentieth century fox film corporation blue wolf,"mrs. doubtfire comedy drama family loving but irresponsible dad daniel hillard, estranged from his exasperated spouse, is crushed by a court order allowing only weekly visits with his kids. when daniel learns his ex needs a housekeeper, he gets the job -- disguised as an english nanny. soon he becomes not only his children's best pal but the kind of parent he should have been from the start. she makes dinner. she does windows. she reads bedtime stories. she's a blessing... in disguise. twentieth century fox film corporation blue wolf"
comedy drama romance,858,sleepless in seattle,a young boy who tries to set his dad up on a date after the death of his mother. he calls into a radio station to talk about his dad’s loneliness which soon leads the dad into meeting a journalist annie who flies to seattle to write a story about the boy and his dad. yet annie ends up with more than just a story in this popular romantic comedy.,10.234919,/jAXfku1u1uaLGh4cUmK0ESf1pPu.jpg,"[{'name': 'TriStar Pictures', 'id': 559}]",1993-06-24,"what if someone you never met, someone you never saw, someone you never knew was the only someone for you?",sleepless in seattle,6.5,630.0,"['Drama', 'Comedy', 'Romance']",tristar pictures,"sleepless in seattle comedy drama romance a young boy who tries to set his dad up on a date after the death of his mother. he calls into a radio station to talk about his dad’s loneliness which soon leads the dad into meeting a journalist annie who flies to seattle to write a story about the boy and his dad. yet annie ends up with more than just a story in this popular romantic comedy. what if someone you never met, someone you never saw, someone you never knew was the only someone for you? tristar pictures"
action thriller crime romance,319,true romance,"clarence marries hooker alabama, steals cocaine from her pimp, and tries to sell it in hollywood, while the owners of the coke try to reclaim it.",17.189328,/39lXk6ud6KiJgGbbWI2PUKS7y2.jpg,"[{'name': 'Davis-Films', 'id': 342}, {'name': 'August Entertainment', 'id': 3322}, {'name': 'Warner Bros.', 'id': 6194}, {'name': 'Morgan Creek Productions', 'id': 10210}]",1993-09-09,"stealing, cheating, killing. who said romance was dead?",true romance,7.5,762.0,"['Thriller', 'Crime', 'Romance', 'Action']",davis-films august entertainment warner bros. morgan creek productions,"true romance action thriller crime romance clarence marries hooker alabama, steals cocaine from her pimp, and tries to sell it in hollywood, while the owners of the coke try to reclaim it. stealing, cheating, killing. who said romance was dead? davis-films august entertainment warner bros. morgan creek productions"
drama fantasy western,922,dead man,"on the run after murdering a man, accountant william blake encounters a strange north american man named nobody who prepares him for his journey into the spiritual world.",6.505272,/jX3wGBVoYoAY3IixBpwYk1fjT4z.jpg,"[{'name': 'JVC Entertainment', 'id': 182}, {'name': 'Pandora Filmproduktion', 'id': 254}, {'name': 'Newmarket Capital Group', 'id': 506}, {'name': '12 Gauge Productions', 'id': 663}]",1995-12-23,no one can survive becoming a legend.,dead man,7.2,397.0,"['Drama', 'Western', 'Fantasy']",jvc entertainment pandora filmproduktion newmarket capital group 12 gauge productions,"dead man drama fantasy western on the run after murdering a man, accountant william blake encounters a strange north american man named nobody who prepares him for his journey into the spiritual world. no one can survive becoming a legend. jvc entertainment pandora filmproduktion newmarket capital group 12 gauge productions"
crime drama thriller,1645,a time to kill,"a young lawyer defends a black man accused of murdering two men who raped his 10-year-old daughter, sparking a rebirth of the kkk.",13.309013,/w8UCke112E9jrhjKcwG32kyhTx5.jpg,"[{'name': 'Regency Enterprises', 'id': 508}, {'name': 'Warner Bros.', 'id': 6194}]",1996-07-24,experience a time you'll never forget.,a time to kill,7.0,522.0,"['Thriller', 'Drama', 'Crime']",regency enterprises warner bros.,"a time to kill crime drama thriller a young lawyer defends a black man accused of murdering two men who raped his 10-year-old daughter, sparking a rebirth of the kkk. experience a time you'll never forget. regency enterprises warner bros."
