genres,id,original_title,overview,popularity,poster_path,production_companies,release_date,tagline,title,vote_average,vote_count,genres_clean,companies_text,content
comedy crime,158,knockin' on heaven's door,"two young men, martin and rudi, both suffering from terminal cancer, get to know each other in a hospital room. they drown their desperation in tequila and decide to take one last trip to the sea. drunk and still in pajamas they steal the first fancy car they find, a 60's mercedes convertible. the car happens to belong to a bunch of gangsters, which immediately start to chase it, since it contains more than the pistol martin finds in the glove box.",7.203307,/dsY09zCxKDFjfV1oqXFJJpVrHdP.jpg,"[{'name': 'Touchstone', 'id': 7594}]",1997-02-20,,knockin' on heaven's door,7.6,135.0,"['Comedy', 'Crime']",touchstone,"knockin' on heaven's door comedy crime two young men, martin and rudi, both suffering from terminal cancer, get to know each other in a hospital room. they drown their desperation in tequila and decide to take one last trip to the sea. drunk and still in pajamas they steal the first fancy car they find, a 60's mercedes convertible. the car happens to belong to a bunch of gangsters, which immediately start to chase it, since it contains more than the pistol martin finds in the glove box.  touchstone"
family animation,953,madagascar,"zoo animals leave the comforts of man-made habitats for exotic adventure in this animated family film. after escaping from the zoo, four friends -- a lion, a hippo, a zebra and a giraffe -- are sent back to africa. when their ship capsizes, stranding them on madagascar, an island populated by crazy critters, the pals must adapt to jungle life and their new roles as wild animals.",16.136217,/zMpJY5CJKUufG9OTw0In4eAFqPX.jpg,"[{'name': 'DreamWorks SKG', 'id': 27}, {'name': 'Pacific Data Images (PDI)', 'id': 520}, {'name': 'DreamWorks Animation', 'id': 521}]",2005-05-25,someone's got a zoo loose.,madagascar,6.6,3322.0,"['Animation', 'Family']",dreamworks skg pacific data images (pdi) dreamworks animation,"madagascar family animation zoo animals leave the comforts of man-made habitats for exotic adventure in this animated family film. after escaping from the zoo, four friends -- a lion, a hippo, a zebra and a giraffe -- are sent back to africa. when their ship capsizes, stranding them on madagascar, an island populated by crazy critters, the pals must adapt to jungle life and their new roles as wild animals. someone's got a zoo loose. dreamworks skg pacific data images (pdi) dreamworks animation"
action crime drama,272,batman begins,"driven by tragedy, billionaire bruce wayne dedicates his life to uncovering and defeating the corruption that plagues his home, gotham city.  unable to work within the system, he instead creates a new identity, a symbol of fear for the criminal underworld - the batman.",28.505341,/sPX89Td70IDDjVr85jdSBb4rWGr.jpg,"[{'name': 'DC Comics', 'id': 429}, {'name': 'Legendary Pictures', 'id': 923}, {'name': 'Warner Bros.', 'id': 6194}, {'name': 'DC Entertainment', 'id': 9993}, {'name': 'Syncopy', 'id': 9996}, {'name': 'Patalex III Productions Limited', 'id': 19231}]",2005-06-10,evil fears the knight.,batman begins,7.5,7511.0,"['Drama', 'Crime', 'Action']",dc comics legendary pictures warner bros. dc entertainment syncopy patalex iii productions limited,"batman begins action crime drama driven by tragedy, billionaire bruce wayne dedicates his life to uncovering and defeating the corruption that plagues his home, gotham city.  unable to work within the system, he instead creates a new identity, a symbol of fear for the criminal underworld - the batman. evil fears the knight. dc comics legendary pictures warner bros. dc entertainment syncopy patalex iii productions limited"
thriller,1917,qui a tué bambi ?,"isabelle, a beautiful nursing student, is starting her internship at a prestigious hospital. she meets dr. philip there, feels atracted to him from the beggining and starts suffering from strange fainting; so he calls her bambi: her legs don't support her. patients mysteriously start to dissappear from their rooms; so bambi and dr. philip start a cat vs. mouse paranoid game, in order to catch the probable killer.",0.682994,/nKhmdbwcMXWM21AqSBKLvV3kdog.jpg,[],2003-12-24,,who killed bambi?,6.0,10.0,['Thriller'],,"who killed bambi? thriller isabelle, a beautiful nursing student, is starting her internship at a prestigious hospital. she meets dr. philip there, feels atracted to him from the beggining and starts suffering from strange fainting; so he calls her bambi: her legs don't support her. patients mysteriously start to dissappear from their rooms; so bambi and dr. philip start a cat vs. mouse paranoid game, in order to catch the probable killer."
romance western,1676,will penny,"will penny, an aging cowpoke, takes a job on a ranch which requires him to ride the line of the property looking for trespassers or, worse, squatters. he finds that his cabin in the high mountains has been appropriated by a woman whose guide to oregon has deserted her and her son. too ashamed to kick mother and child out just as the bitter winter of the mountains sets in, he agrees to share the cabin until the spring thaw. but it isn't just the snow that slowly thaws; the lonely man and woman soon forget their mutual hostility and start developing a deep love for one another.",4.010324,/v3RcNrqutEPGsiTLd31J3U735kB.jpg,"[{'name': 'Paramount Pictures', 'id': 4}]",1967-12-19,the brute in everyman was also in him - and the love and the violence,will penny,6.4,20.0,"['Romance', 'Western']",paramount pictures,"will penny romance western will penny, an aging cowpoke, takes a job on a ranch which requires him to ride the line of the property looking for trespassers or, worse, squatters. he finds that his cabin in the high mountains has been appropriated by a woman whose guide to oregon has deserted her and her son. too ashamed to kick mother and child out just as the bitter winter of the mountains sets in, he agrees to share the cabin until the spring thaw. but it isn't just the snow that slowly thaws; the lonely man and woman soon forget their mutual hostility and start developing a deep love for one another. the brute in everyman was also in him - and the love and the violence paramount pictures"
drama,1947,an unfinished life,"stoic and heartbroken, einar gilkyson quietly lives in the rugged wyoming ranchlands alongside his only trusted friend, mitch bradley. then, suddenly, the woman he blames for the death of his only son arrives at his door broke, desperate, and with a granddaughter he's never known. but even as buried anger and accusations resurface, the way is opened for unexpected connection, adventure, and forgiveness.",7.761954,/7ugLG1yF1l8HWYhmdmHHSC3kJ8b.jpg,"[{'name': 'Miramax Films', 'id': 14}, {'name': 'Revolution Studios', 'id': 497}, {'name': 'Persistent Entertainment', 'id': 810}, {'name': 'Initial Entertainment Group (IEG)', 'id': 7380}, {'name': 'The Ladd Company', 'id': 7965}, {'name': 'Kalis Productions GmbH & Co. Zweite KG', 'id': 20376}, {'name': 'Unfinished Films', 'id': 20377}]",2005-09-09,every secret takes on a life of its own.,an unfinished life,6.7,165.0,['Drama'],miramax films revolution studios persistent entertainment initial entertainment group (ieg) the ladd company kalis productions gmbh & co. zweite kg unfinished films,"an unfinished life drama stoic and heartbroken, einar gilkyson quietly lives in the rugged wyoming ranchlands alongside his only trusted friend, mitch bradley. then, suddenly, the woman he blames for the death of his only son arrives at his door broke, desperate, and with a granddaughter he's never known. but even as buried anger and accusations resurface, the way is opened for unexpected connection, adventure, and forgiveness. every secret takes on a life of its own. miramax films revolution studios persistent entertainment initial entertainment group (ieg) the ladd company kalis productions gmbh & co. zweite kg unfinished films"
comedy,349,crustacés et coquillages,crustaces et coquillages is a fresh french comedy film with numerous surprise turnarounds and about the tolerance of a family of four. the family spend an idealistic summer vacation together where each of the family members gets involved in a new or old relationship.,2.542936,/eQPrrzj76pQxmprQ3LpHhriZqlJ.jpg,"[{'name': 'Bac Films', 'id': 208}]",2005-03-30,,cockles and muscles,5.1,7.0,['Comedy'],bac films,cockles and muscles comedy crustaces et coquillages is a fresh french comedy film with numerous surprise turnarounds and about the tolerance of a family of four. the family spend an idealistic summer vacation together where each of the family members gets involved in a new or old relationship.  bac films
drama music,3527,don't come knocking,"howard spence has seen better days. once a big western movie star, he now drowns his disgust for his selfish and failed life with alcohol, drugs and young women. if he were to die now, nobody would shed a tear over him, that's the sad truth. until one day howard learns that he might have a child somewhere out there...",3.348019,/sF9LWvw71gaGR46QtJIFGtLXhWc.jpg,"[{'name': 'Sony Pictures Classics', 'id': 58}, {'name': 'Reverse Angle International', 'id': 742}, {'name': 'Océanic Films', 'id': 1166}, {'name': 'Road Movies Filmproduktion', 'id': 8366}, {'name': 'ZDF/Arte', 'id': 11237}, {'name': 'Recorded Picture Company (RPC)', 'id': 11561}, {'name': 'Reverse Angle Pictures (II)', 'id': 14675}, {'name': 'EuroArts Medien AG', 'id': 14676}, {'name': 'Network Movie Film-und Fernsehproduktion', 'id': 14677}, {'name': 'Wim Wenders Stiftung', 'id': 36229}]",2005-05-19,,don't come knocking,6.4,23.0,"['Drama', 'Music']",sony pictures classics reverse angle international océanic films road movies filmproduktion zdf/arte recorded picture company (rpc) reverse angle pictures (ii) euroarts medien ag network movie film-und fernsehproduktion wim wenders stiftung,"don't come knocking drama music howard spence has seen better days. once a big western movie star, he now drowns his disgust for his selfish and failed life with alcohol, drugs and young women. if he were to die now, nobody would shed a tear over him, that's the sad truth. until one day howard learns that he might have a child somewhere out there...  sony pictures classics reverse angle international océanic films road movies filmproduktion zdf/arte recorded picture company (rpc) reverse angle pictures (ii) euroarts medien ag network movie film-und fernsehproduktion wim wenders stiftung"
documentary music,41566,new york doll,"a recovering alcoholic and recently converted mormon, arthur ""killer"" kane, of the rock band the new york dolls, is given a chance at reuniting with his band after 30 years.",0.329019,/ejsAQPUusg83vXpzji54wMJXBsf.jpg,[],2005-01-01,,new york doll,6.8,8.0,"['Music', 'Documentary']",,"new york doll documentary music a recovering alcoholic and recently converted mormon, arthur ""killer"" kane, of the rock band the new york dolls, is given a chance at reuniting with his band after 30 years."
drama war,25,jarhead,"jarhead is a film about a us marine anthony swofford’s experience in the gulf war. after putting up with an arduous boot camp, swafford and his unit are sent to the persian gulf where they are earger to fight but are forced to stay back from the action. meanwhile swofford gets news of his girlfriend is cheating on him. desperately he wants to kill someone and finally put his training to use.",9.997032,/4rCzaZy5Qkvxh5xaVpHriXSLTgC.jpg,"[{'name': 'Universal Pictures', 'id': 33}, {'name': 'Neal Street Productions', 'id': 1522}, {'name': 'Red Wagon Entertainment', 'id': 14440}, {'name': 'Motion Picture KAPPA Produktionsgesellschaft', 'id': 19934}]",2005-11-04,welcome to the suck.,jarhead,6.6,776.0,"['Drama', 'War']",universal pictures neal street productions red wagon entertainment motion picture kappa produktionsgesellschaft,"jarhead drama war jarhead is a film about a us marine anthony swofford’s experience in the gulf war. after putting up with an arduous boot camp, swafford and his unit are sent to the persian gulf where they are earger to fight but are forced to stay back from the action. meanwhile swofford gets news of his girlfriend is cheating on him. desperately he wants to kill someone and finally put his training to use. welcome to the suck. universal pictures neal street productions red wagon entertainment motion picture kappa produktionsgesellschaft"
drama thriller,231,syriana,"the middle eastern oil industry is the backdrop of this tense drama, which weaves together numerous story lines. bennett holiday is an american lawyer in charge of facilitating a dubious merger of oil companies, while bryan woodman, a switzerland-based energy analyst, experiences both personal tragedy and opportunity during a visit with arabian royalty. meanwhile, veteran cia agent bob barnes uncovers an assassination plot with unsettling origins.",5.768575,/mO3hWUTOxmLJxihvDU0YFkb0Mb5.jpg,"[{'name': 'Section Eight', 'id': 129}, {'name': 'Warner Bros.', 'id': 6194}, {'name': 'Participant Media', 'id': 6735}, {'name': 'FilmWorks', 'id': 7786}, {'name': '4M', 'id': 20665}, {'name': 'MID Foundation', 'id': 20666}]",2005-11-23,everything is connected.,syriana,6.3,455.0,"['Thriller', 'Drama']",section eight warner bros. participant media filmworks 4m mid foundation,"syriana drama thriller the middle eastern oil industry is the backdrop of this tense drama, which weaves together numerous story lines. bennett holiday is an american lawyer in charge of facilitating a dubious merger of oil companies, while bryan woodman, a switzerland-based energy analyst, experiences both personal tragedy and opportunity during a visit with arabian royalty. meanwhile, veteran cia agent bob barnes uncovers an assassination plot with unsettling origins. everything is connected. section eight warner bros. participant media filmworks 4m mid foundation"
drama,6934,yesterday,"after falling ill, yesterday learns that she is hiv positive. with her husband in denial and young daughter to tend to, yesterday's one goal is to live long enough to see her child go to school.",1.678469,/lNCjiLoU1Pg3pgK6jGnFn3R60zE.jpg,"[{'name': 'Distant Horizons', 'id': 1066}, {'name': 'HBO Films', 'id': 7429}, {'name': 'Dv8', 'id': 75879}, {'name': 'Exciting Films', 'id': 75880}]",2004-09-03,,yesterday,8.3,6.0,['Drama'],distant horizons hbo films dv8 exciting films,"yesterday drama after falling ill, yesterday learns that she is hiv positive. with her husband in denial and young daughter to tend to, yesterday's one goal is to live long enough to see her child go to school.  distant horizons hbo films dv8 exciting films"
horror,1690,hostel,"three backpackers head to a slovakian city that promises to meet their hedonistic expectations, with no idea of the hell that awaits them.",12.093928,/dDrtuWUKhgUGp12kgUWuP0NpTdF.jpg,"[{'name': 'International Production Company', 'id': 1507}, {'name': 'Raw Nerve', 'id': 1631}, {'name': 'Lionsgate', 'id': 1632}, {'name': 'Next Entertainment', 'id': 1633}, {'name': 'Screen Gems', 'id': 3287}, {'name': 'Hostel LLC', 'id': 17793}]",2005-01-06,welcome to your worst nightmare,hostel,5.7,913.0,['Horror'],international production company raw nerve lionsgate next entertainment screen gems hostel llc,"hostel horror three backpackers head to a slovakian city that promises to meet their hedonistic expectations, with no idea of the hell that awaits them. welcome to your worst nightmare international production company raw nerve lionsgate next entertainment screen gems hostel llc"
drama comedy crime,2455,vivement dimanche!,"claude massoulier is murdered while hunting at the same place as julien vercel (jean-louis trintignant), an estate agent who knew him and whose fingerprints are found on massoulier's car. as the police discover that marie-christine vercel (caroline sihol), julien's wife, was massoulier's mistress, julien is the prime suspect. but his secretary, barbara becker (fanny ardant), while not quite convinced he is innocent, defends him and leads her private investigations.",2.672873,/bBCijSkvfyP6HSrMX13brgUYFwf.jpg,"[{'name': 'Les Films du Carrosse', 'id': 53}, {'name': 'Soprofilms', 'id': 472}, {'name': 'Films A2', 'id': 875}]",1983-08-10,,confidentially yours,7.1,25.0,"['Drama', 'Comedy', 'Crime']",les films du carrosse soprofilms films a2,"confidentially yours drama comedy crime claude massoulier is murdered while hunting at the same place as julien vercel (jean-louis trintignant), an estate agent who knew him and whose fingerprints are found on massoulier's car. as the police discover that marie-christine vercel (caroline sihol), julien's wife, was massoulier's mistress, julien is the prime suspect. but his secretary, barbara becker (fanny ardant), while not quite convinced he is innocent, defends him and leads her private investigations.  les films du carrosse soprofilms films a2"
horror thriller mystery,17,the dark,adèle and her daughter sarah are traveling on the welsh coastline to see her husband james when sarah disappears. a different but similar looking girl appears who says she died in a past time. adèle tries to discover what happened to her daughter as she is tormented by celtic mythology from the past.,5.691508,/h6gCVAzjFLhzkffv2VZO1RgVCBt.jpg,"[{'name': 'Constantin Film', 'id': 47}, {'name': 'Impact Pictures', 'id': 248}, {'name': 'Isle of Man Film', 'id': 2268}, {'name': 'UK Film Council', 'id': 2452}]",2006-01-26,one of the living for one of the dead.,the dark,5.6,76.0,"['Thriller', 'Horror', 'Mystery']",constantin film impact pictures isle of man film uk film council,the dark horror thriller mystery adèle and her daughter sarah are traveling on the welsh coastline to see her husband james when sarah disappears. a different but similar looking girl appears who says she died in a past time. adèle tries to discover what happened to her daughter as she is tormented by celtic mythology from the past. one of the living for one of the dead. constantin film impact pictures isle of man film uk film council
comedy documentary music,292,dave chappelle's block party,"the american comedian/actor delivers a story about the alternative hip hop scene. a small town ohio man’s moves to brooklyn, new york, to throw an unprecedented block party. filmed with inspiration from the 1973 documentary wattstax.",2.092791,/lGS9iKGGRjM049ZGK4J8TvQeBHg.jpg,"[{'name': 'Yari Film Group', 'id': 2448}]",2005-09-12,,dave chappelle's block party,6.5,29.0,"['Music', 'Comedy', 'Documentary']",yari film group,"dave chappelle's block party comedy documentary music the american comedian/actor delivers a story about the alternative hip hop scene. a small town ohio man’s moves to brooklyn, new york, to throw an unprecedented block party. filmed with inspiration from the 1973 documentary wattstax.  yari film group"
drama comedy romance,1544,imagine me & you,"during her wedding ceremony, rachel notices luce in the audience and feels instantly drawn to her. the two women become close friends, and when rachel learns that luce is a lesbian, she realizes that despite her happy marriage to heck, she is falling for luce. as she questions her sexual orientation, rachel must decide between her stable relationship with heck and her exhilarating new romance with luce.",6.008971,/oF0wgVKumU52W7nBR6oHJb5FqSa.jpg,"[{'name': 'BBC Films', 'id': 288}, {'name': 'Filmstiftung Nordrhein-Westfalen', 'id': 315}, {'name': 'X-Filme Creative Pool', 'id': 1972}, {'name': 'Ealing Studios', 'id': 2650}, {'name': 'Fragile Films', 'id': 2651}, {'name': 'Focus Features', 'id': 10146}, {'name': 'RTL', 'id': 42272}, {'name': 'Cougar Films Ltd.', 'id': 52728}, {'name': 'Minotaur Film Partnership No. 3', 'id': 52729}]",2005-02-01,there goes the bride.,imagine me & you,7.0,181.0,"['Drama', 'Comedy', 'Romance']",bbc films filmstiftung nordrhein-westfalen x-filme creative pool ealing studios fragile films focus features rtl cougar films ltd. minotaur film partnership no. 3,"imagine me & you drama comedy romance during her wedding ceremony, rachel notices luce in the audience and feels instantly drawn to her. the two women become close friends, and when rachel learns that luce is a lesbian, she realizes that despite her happy marriage to heck, she is falling for luce. as she questions her sexual orientation, rachel must decide between her stable relationship with heck and her exhilarating new romance with luce. there goes the bride. bbc films filmstiftung nordrhein-westfalen x-filme creative pool ealing studios fragile films focus features rtl cougar films ltd. minotaur film partnership no. 3"
drama romance,1967,ask the dust,"mexican beauty camilla hopes to rise above her station by marrying a wealthy american. that is complicated by meeting arturo bandini, a first-generation italian hoping to land a writing career and a blue-eyed blonde on his arm.",4.049118,/iuJZyJNiQxnmMBBqu40mF0a2nuv.jpg,"[{'name': 'Paramount Pictures', 'id': 4}, {'name': 'Cruise/Wagner Productions', 'id': 44}, {'name': 'Capitol Films', 'id': 826}, {'name': 'Ascendant Pictures', 'id': 1204}, {'name': 'Noble House Entertainment Pictures', 'id': 19501}]",2006-02-02,passion and ambition drive two dreamers in 1930s la. their love affair is ferocious and hot-blooded as they fight the city and themselves to make their dreams come true.,ask the dust,5.2,42.0,"['Drama', 'Romance']",paramount pictures cruise/wagner productions capitol films ascendant pictures noble house entertainment pictures,"ask the dust drama romance mexican beauty camilla hopes to rise above her station by marrying a wealthy american. that is complicated by meeting arturo bandini, a first-generation italian hoping to land a writing career and a blue-eyed blonde on his arm. passion and ambition drive two dreamers in 1930s la. their love affair is ferocious and hot-blooded as they fight the city and themselves to make their dreams come true. paramount pictures cruise/wagner productions capitol films ascendant pictures noble house entertainment pictures"
drama thriller crime mystery,186,lucky number slevin,"slevin is mistakenly put in the middle of a personal war between the city’s biggest criminal bosses. under constant watch, slevin must try not to get killed by an infamous assassin and come up with an idea of how to get out of his current dilemma. a film with many twists and turns.",11.15092,/x21s3p5wPww534nYj1cWakTcqz4.jpg,"[{'name': 'The Weinstein Company', 'id': 308}, {'name': 'FilmEngine', 'id': 816}, {'name': 'Capitol Films', 'id': 826}, {'name': 'Ascendant Pictures', 'id': 1204}, {'name': 'VIP Medienfonds 4', 'id': 2116}, {'name': 'The Complex Studio', 'id': 21962}]",2006-02-24,wrong time. wrong place. wrong number.,lucky number slevin,7.4,1356.0,"['Thriller', 'Drama', 'Crime', 'Mystery']",the weinstein company filmengine capitol films ascendant pictures vip medienfonds 4 the complex studio,"lucky number slevin drama thriller crime mystery slevin is mistakenly put in the middle of a personal war between the city’s biggest criminal bosses. under constant watch, slevin must try not to get killed by an infamous assassin and come up with an idea of how to get out of his current dilemma. a film with many twists and turns. wrong time. wrong place. wrong number. the weinstein company filmengine capitol films ascendant pictures vip medienfonds 4 the complex studio"
horror mystery,588,silent hill,"the eerie and deserted ghost town of silent hill draws a young mother desperate to find a cure for her only child's illness. unable to accept the doctor's diagnosis that her daughter should be permanently institutionalized for psychiatric care, rose flees with her child, heading for the abandoned town in search of answers – and ignoring the protests of her husband. it's soon clear this place is unlike anywhere she's ever been. it's smothered by fog, inhabited by a variety of strange beings and periodically overcome by a living 'darkness' that literally transforms everything it touches. as rose searches for her little girl, she begins to learn the history of the strange town and realizes that her daughter is just a pawn in a larger game.",7.938457,/bQkXL0cSlPviaQhxM090knCc5kS.jpg,"[{'name': 'Silent Hill DCP Inc.', 'id': 341}, {'name': 'Davis-Films', 'id': 342}, {'name': 'TriStar Pictures', 'id': 559}, {'name': 'Konami', 'id': 55914}]",2006-04-21,we've been expecting you.,silent hill,6.3,1093.0,"['Horror', 'Mystery']",silent hill dcp inc. davis-films tristar pictures konami,"silent hill horror mystery the eerie and deserted ghost town of silent hill draws a young mother desperate to find a cure for her only child's illness. unable to accept the doctor's diagnosis that her daughter should be permanently institutionalized for psychiatric care, rose flees with her child, heading for the abandoned town in search of answers – and ignoring the protests of her husband. it's soon clear this place is unlike anywhere she's ever been. it's smothered by fog, inhabited by a variety of strange beings and periodically overcome by a living 'darkness' that literally transforms everything it touches. as rose searches for her little girl, she begins to learn the history of the strange town and realizes that her daughter is just a pawn in a larger game. we've been expecting you. silent hill dcp inc. davis-films tristar pictures konami"
