genres,id,original_title,overview,popularity,poster_path,production_companies,release_date,tagline,title,vote_average,vote_count,genres_clean,companies_text,content
romance drama,216,angst essen seele auf,"a simple, delicate, melodramatic german film about a loneliness. with a double moral story about the tainted love between an old woman and a younger moroccan immigrant worker.",5.855308,/5Oru4v8tRUN90JUuM6BNDJoetLt.jpg,"[{'name': 'Filmverlag der Autoren', 'id': 10869}, {'name': 'Tango Film', 'id': 11626}]",1974-03-05,,ali: fear eats the soul,7.5,74.0,"['Drama', 'Romance']",filmverlag der autoren tango film,"ali: fear eats the soul romance drama a simple, delicate, melodramatic german film about a loneliness. with a double moral story about the tainted love between an old woman and a younger moroccan immigrant worker.  filmverlag der autoren tango film"
action thriller science fiction,296,terminator 3: rise of the machines,"it's been 10 years since john connor saved earth from judgment day, and he's now living under the radar, steering clear of using anything skynet can trace. that is, until he encounters t-x, a robotic assassin ordered to finish what t-1000 started. good thing connor's former nemesis, the terminator, is back to aid the now-adult connor … just like he promised.",20.818907,/vvevzdYIrk2636maNW4qeWmlPFG.jpg,"[{'name': 'Columbia Pictures', 'id': 5}, {'name': 'Intermedia Films', 'id': 763}, {'name': 'Warner Bros.', 'id': 6194}, {'name': 'C-2 Pictures', 'id': 7340}, {'name': 'IMF Internationale Medien und Film GmbH & Co. 3. Produktions KG', 'id': 19116}, {'name': 'Mostow/Lieberman Productions', 'id': 23636}]",2003-07-02,the machines will rise.,terminator 3: rise of the machines,5.9,2177.0,"['Thriller', 'Action', 'Science Fiction']",columbia pictures intermedia films warner bros. c-2 pictures imf internationale medien und film gmbh & co. 3. produktions kg mostow/lieberman productions,"terminator 3: rise of the machines action thriller science fiction it's been 10 years since john connor saved earth from judgment day, and he's now living under the radar, steering clear of using anything skynet can trace. that is, until he encounters t-x, a robotic assassin ordered to finish what t-1000 started. good thing connor's former nemesis, the terminator, is back to aid the now-adult connor … just like he promised. the machines will rise. columbia pictures intermedia films warner bros. c-2 pictures imf internationale medien und film gmbh & co. 3. produktions kg mostow/lieberman productions"
adventure fantasy action,22,pirates of the caribbean: the curse of the black pearl,"jack sparrow, a freewheeling 17th-century pirate who roams the caribbean sea, butts heads with a rival pirate bent on pillaging the village of port royal. when the governor's daughter is kidnapped, sparrow decides to help the girl's love save her. but their seafaring mission is hardly simple.",47.326665,/poHwCZeWzJCShH7tOjg8RIoyjcw.jpg,"[{'name': 'Walt Disney Pictures', 'id': 2}, {'name': 'Jerry Bruckheimer Films', 'id': 130}]",2003-07-09,prepare to be blown out of the water.,pirates of the caribbean: the curse of the black pearl,7.5,7191.0,"['Action', 'Fantasy', 'Adventure']",walt disney pictures jerry bruckheimer films,"pirates of the caribbean: the curse of the black pearl adventure fantasy action jack sparrow, a freewheeling 17th-century pirate who roams the caribbean sea, butts heads with a rival pirate bent on pillaging the village of port royal. when the governor's daughter is kidnapped, sparrow decides to help the girl's love save her. but their seafaring mission is hardly simple. prepare to be blown out of the water. walt disney pictures jerry bruckheimer films"
adventure action comedy thriller crime,8961,bad boys ii,"out-of-control, trash-talking buddy cops marcus burnett and mike lowrey of the miami narcotics task force reunite, and bullets fly, cars crash and laughs explode as they pursue a whacked-out drug lord from the streets of miami to the barrios of cuba. but the real fireworks result when marcus discovers that playboy mike is secretly romancing marcus’ sexy sister.",8.191436,/yCvB5fG5aEPqa1St7ihY6KEAsHD.jpg,"[{'name': 'Columbia Pictures Corporation', 'id': 441}, {'name': 'Don Simpson/Jerry Bruckheimer Films', 'id': 10288}]",2003-07-18,"if you can't stand the heat, get out of miami.",bad boys ii,6.3,1588.0,"['Thriller', 'Comedy', 'Crime', 'Action', 'Adventure']",columbia pictures corporation don simpson/jerry bruckheimer films,"bad boys ii adventure action comedy thriller crime out-of-control, trash-talking buddy cops marcus burnett and mike lowrey of the miami narcotics task force reunite, and bullets fly, cars crash and laughs explode as they pursue a whacked-out drug lord from the streets of miami to the barrios of cuba. but the real fireworks result when marcus discovers that playboy mike is secretly romancing marcus’ sexy sister. if you can't stand the heat, get out of miami. columbia pictures corporation don simpson/jerry bruckheimer films"
action comedy crime,3101,i love you to death,"joey boca is the owner of a pizza parlor located in tacoma, washington, and has been married to rosalie for years. rosalie is horrified to discover that joey is a womanizer and has been cheating on her for a long time. based on the true story of frances and anthony toto.",8.11216,/8LdWJLUfEa5JeUJ7SljJQMIJikZ.jpg,"[{'name': 'TriStar Pictures', 'id': 559}]",1990-04-06,"with these people trying to kill him, joey boca may just live forever",i love you to death,6.2,68.0,"['Comedy', 'Crime', 'Action']",tristar pictures,"i love you to death action comedy crime joey boca is the owner of a pizza parlor located in tacoma, washington, and has been married to rosalie for years. rosalie is horrified to discover that joey is a womanizer and has been cheating on her for a long time. based on the true story of frances and anthony toto. with these people trying to kill him, joey boca may just live forever tristar pictures"
comedy drama music romance,333,bollywood/hollywood,"rahul seth is a dashing young millionaire who believes he is ""western"" enough to rebel against his mother and grandmother. they are not too keen about his caucasian girlfriend kimberly who, to make matters worse, is a pop star. before you can say ""karmic intervention,"" kimberly dies in a freak accident and rahul is devastated. instead of allowing him to mourn in peace, rahul's mother sees the opportunity she's been waiting for. she threatens to call off his sister's wedding unless he finds himself a ""nice indian girl."" rahul enlists the services of sue, a fiercely independent escort whom he believes to be hispanic, and therefore not ""married"" to the conventions taught to young indian women. with a wink in her eye, sue accepts the deal to pose as his indian bride-to-be. she needs the money and having never been a fan of the typical indian male, she feels her heart is safe. the charade begins....",2.015731,/pXIVHT73QG70nZZdsVMwa0OgFUK.jpg,"[{'name': 'Different Tree Same Wood Productions', 'id': 176}]",2002-01-01,,bollywood/hollywood,6.1,4.0,"['Drama', 'Music', 'Comedy', 'Romance']",different tree same wood productions,"bollywood/hollywood comedy drama music romance rahul seth is a dashing young millionaire who believes he is ""western"" enough to rebel against his mother and grandmother. they are not too keen about his caucasian girlfriend kimberly who, to make matters worse, is a pop star. before you can say ""karmic intervention,"" kimberly dies in a freak accident and rahul is devastated. instead of allowing him to mourn in peace, rahul's mother sees the opportunity she's been waiting for. she threatens to call off his sister's wedding unless he finds himself a ""nice indian girl."" rahul enlists the services of sue, a fiercely independent escort whom he believes to be hispanic, and therefore not ""married"" to the conventions taught to young indian women. with a wink in her eye, sue accepts the deal to pose as his indian bride-to-be. she needs the money and having never been a fan of the typical indian male, she feels her heart is safe. the charade begins....  different tree same wood productions"
drama,153,lost in translation,"two lost souls visiting tokyo -- the young, neglected wife of a photographer and a washed-up movie star shooting a tv commercial -- find an odd solace and pensive freedom to be real in each other's company, away from their lives in america.",11.609441,/3jCLmYDIIiSMPujbwygNpqdpM8N.jpg,"[{'name': 'American Zoetrope', 'id': 70}]",2003-08-31,everyone wants to be found.,lost in translation,7.3,1943.0,['Drama'],american zoetrope,"lost in translation drama two lost souls visiting tokyo -- the young, neglected wife of a photographer and a washed-up movie star shooting a tv commercial -- find an odd solace and pensive freedom to be real in each other's company, away from their lives in america. everyone wants to be found. american zoetrope"
documentary,1358,a brief history of time,"a documentary film based on the life of scientist steven hawking. the film explores the intimate life of steven hawking through him, his friends and his family, as he goes through school, is diagnosed with a degenerative disease, and discovers revolutionary theories about time, black holes, and the origin of the universe. a visually interesting and at times funny film about a extraordinary life.",2.4312,/A3sVrDThz8Xthfq2EglWoypKEfU.jpg,"[{'name': 'Anglia Television', 'id': 1391}, {'name': 'National Broadcasting Company', 'id': 1392}, {'name': 'Tokyo Broadcasting System (TBS)', 'id': 1393}]",1991-10-01,,a brief history of time,7.4,37.0,['Documentary'],anglia television national broadcasting company tokyo broadcasting system (tbs),"a brief history of time documentary a documentary film based on the life of scientist steven hawking. the film explores the intimate life of steven hawking through him, his friends and his family, as he goes through school, is diagnosed with a degenerative disease, and discovers revolutionary theories about time, black holes, and the origin of the universe. a visually interesting and at times funny film about a extraordinary life.  anglia television national broadcasting company tokyo broadcasting system (tbs)"
comedy music,1584,school of rock,"fired from his band and hard up for cash, guitarist and vocalist dewey finn finagles his way into a job as a fourth-grade substitute teacher at a private school, where he secretly begins teaching his students the finer points of rock 'n' roll. the school's hard-nosed principal is rightly suspicious of finn's activities. but finn's roommate remains in the dark about what he's doing.",17.95142,/zXLXaepIBvFVLU25DH3wv4IPSbe.jpg,"[{'name': 'Paramount Pictures', 'id': 4}, {'name': 'Scott Rudin Productions', 'id': 258}, {'name': 'Nickelodeon Movies', 'id': 2348}, {'name': 'NEW Century', 'id': 8647}, {'name': 'MFP Munich Film Partners GmbH & Company I. Produktions KG', 'id': 21409}, {'name': 'Sor Productions', 'id': 88628}]",2003-10-03,he just landed the gig of his life: 5th grade.,school of rock,6.8,1454.0,"['Music', 'Comedy']",paramount pictures scott rudin productions nickelodeon movies new century mfp munich film partners gmbh & company i. produktions kg sor productions,"school of rock comedy music fired from his band and hard up for cash, guitarist and vocalist dewey finn finagles his way into a job as a fourth-grade substitute teacher at a private school, where he secretly begins teaching his students the finer points of rock 'n' roll. the school's hard-nosed principal is rightly suspicious of finn's activities. but finn's roommate remains in the dark about what he's doing. he just landed the gig of his life: 5th grade. paramount pictures scott rudin productions nickelodeon movies new century mfp munich film partners gmbh & company i. produktions kg sor productions"
crime drama,1376,sweet sixteen,"determined to have a normal family life once his mother gets out of prison, a scottish teenager from a tough background sets out to raise the money for a home.",12.130265,/p5h50WEZQ4pRFffnSULqL4cEuLp.jpg,"[{'name': 'Alta Films S.A.', 'id': 697}, {'name': 'TTornasol Films S.A.', 'id': 699}]",2002-05-21,life... it's about to hit the fan!,sweet sixteen,6.5,48.0,"['Drama', 'Crime']",alta films s.a. ttornasol films s.a.,"sweet sixteen crime drama determined to have a normal family life once his mother gets out of prison, a scottish teenager from a tough background sets out to raise the money for a home. life... it's about to hit the fan! alta films s.a. ttornasol films s.a."
drama history,224,człowiek z marmuru,man of marble is a polish film about a student making a film about a bricklayer who was once idolized. she interviews people who knew him and finds old footage that lead to an unfolding mystery that causes her producer to cancel the project.,2.78344,/6rJekdaaRSnuz86BsWPHGKs3fhI.jpg,"[{'name': 'Film Polski Film Agency', 'id': 52}, {'name': 'Zespól Filmowy ""X""', 'id': 6804}]",1977-02-25,,man of marble,5.8,16.0,"['Drama', 'History']","film polski film agency zespól filmowy ""x""","man of marble drama history man of marble is a polish film about a student making a film about a bricklayer who was once idolized. she interviews people who knew him and finds old footage that lead to an unfolding mystery that causes her producer to cancel the project.  film polski film agency zespól filmowy ""x"""
comedy romance drama,508,love actually,follows seemingly unrelated people as their lives begin to intertwine while they fall in – and out – of love. affections languish and develop as christmas draws near.,10.586815,/7QPeVsr9rcFU9Gl90yg0gTOTpVv.jpg,"[{'name': 'Universal Pictures', 'id': 33}, {'name': 'DNA Films', 'id': 284}, {'name': 'StudioCanal', 'id': 694}, {'name': 'Working Title Films', 'id': 10163}]",2003-09-07,the ultimate romantic comedy.,love actually,7.0,1917.0,"['Drama', 'Comedy', 'Romance']",universal pictures dna films studiocanal working title films,love actually comedy romance drama follows seemingly unrelated people as their lives begin to intertwine while they fall in – and out – of love. affections languish and develop as christmas draws near. the ultimate romantic comedy. universal pictures dna films studiocanal working title films
drama history,780,la passion de jeanne d'arc,"a classic of the silent age, this film tells the story of the doomed but ultimately canonized 15th-century teenage warrior. on trial for claiming she'd spoken to god, jeanne d'arc is subjected to inhumane treatment and scare tactics at the hands of church court officials. initially bullied into changing her story, jeanne eventually opts for what she sees as the truth. her punishment, a famously brutal execution, earns her perpetual martyrdom.",8.903953,/8OYGtQlO8k9PcOm49apV62eVJQo.jpg,"[{'name': 'Société générale des films', 'id': 1237}]",1928-04-21,an immortal screen classic that will live forever!,the passion of joan of arc,8.2,159.0,"['Drama', 'History']",société générale des films,"the passion of joan of arc drama history a classic of the silent age, this film tells the story of the doomed but ultimately canonized 15th-century teenage warrior. on trial for claiming she'd spoken to god, jeanne d'arc is subjected to inhumane treatment and scare tactics at the hands of church court officials. initially bullied into changing her story, jeanne eventually opts for what she sees as the truth. her punishment, a famously brutal execution, earns her perpetual martyrdom. an immortal screen classic that will live forever! société générale des films"
drama romance,899,broken blossoms,broken blossoms is an american silent film from director d. w. griffith. this melodrama tells the love story of an abused english woman and a chinese buddhist in a time when london was a brutal and harsh place to live.,3.185824,/njwFIUL76zaRmPemnrZVmmTSCjz.jpg,"[{'name': 'United Artists', 'id': 60}, {'name': 'D.W. Griffith Productions', 'id': 4759}]",1919-05-13,,broken blossoms,6.9,41.0,"['Drama', 'Romance']",united artists d.w. griffith productions,broken blossoms drama romance broken blossoms is an american silent film from director d. w. griffith. this melodrama tells the love story of an abused english woman and a chinese buddhist in a time when london was a brutal and harsh place to live.  united artists d.w. griffith productions
drama thriller adventure,3176,バトル・ロワイアル,"in the future, the japanese government captures a class of ninth-grade students and forces them to kill each other under the revolutionary ""battle royale"" act.",12.701098,/gFX7NuBUeKysOB9nEzRqVpHNT32.jpg,"[{'name': 'Nippon Shuppan Hanbai (Nippan) K.K.', 'id': 3032}, {'name': 'GAGA', 'id': 3656}, {'name': 'WoWow', 'id': 5073}, {'name': 'AM Associates', 'id': 11538}, {'name': 'Kobi Co.', 'id': 11539}, {'name': 'MF Pictures', 'id': 11540}]",2000-12-16,could you kill your best friend?,battle royale,7.3,992.0,"['Thriller', 'Drama', 'Adventure']",nippon shuppan hanbai (nippan) k.k. gaga wowow am associates kobi co. mf pictures,"battle royale drama thriller adventure in the future, the japanese government captures a class of ninth-grade students and forces them to kill each other under the revolutionary ""battle royale"" act. could you kill your best friend? nippon shuppan hanbai (nippan) k.k. gaga wowow am associates kobi co. mf pictures"
drama,898,birdman of alcatraz,"after killing a prison guard, convict robert stroud faces life imprisonment in solitary confinement. driven nearly mad by loneliness and despair, stroud's life gains new meaning when he happens upon a helpless baby sparrow in the exercise yard and nurses it back to health. despite having only a third grade education, stroud goes on to become a renowned ornithologist and achieves a greater sense of freedom and purpose behind bars than most people find in the outside world.",4.471515,/6EODLN11HTX4l2cmakAhWIoJLF.jpg,"[{'name': 'Norma Productions', 'id': 584}]",1962-07-03,inside the rock called alcatraz they tried to chain a volcano they called,birdman of alcatraz,7.0,71.0,['Drama'],norma productions,"birdman of alcatraz drama after killing a prison guard, convict robert stroud faces life imprisonment in solitary confinement. driven nearly mad by loneliness and despair, stroud's life gains new meaning when he happens upon a helpless baby sparrow in the exercise yard and nurses it back to health. despite having only a third grade education, stroud goes on to become a renowned ornithologist and achieves a greater sense of freedom and purpose behind bars than most people find in the outside world. inside the rock called alcatraz they tried to chain a volcano they called norma productions"
adventure drama history,2000,"aguirre, der zorn gottes","a few decades after the destruction of the inca empire, a spanish expedition leaves the mountains of peru and goes down the amazon river in search of gold and wealth. soon, they come across great difficulties and don aguirre, a ruthless man who cares only about riches, becomes their leader. but will his quest lead them to ""the golden city"", or to certain destruction?",10.996826,/qMk93yMo82svW27FEjudgueBMUL.jpg,"[{'name': 'Werner Herzog Filmproduktion', 'id': 843}, {'name': 'Hessischer Rundfunk (HR)', 'id': 9292}]",1972-12-29,a breathtaking journey into the heart of darkness,aguirre: the wrath of god,7.5,210.0,"['Drama', 'History', 'Adventure']",werner herzog filmproduktion hessischer rundfunk (hr),"aguirre: the wrath of god adventure drama history a few decades after the destruction of the inca empire, a spanish expedition leaves the mountains of peru and goes down the amazon river in search of gold and wealth. soon, they come across great difficulties and don aguirre, a ruthless man who cares only about riches, becomes their leader. but will his quest lead them to ""the golden city"", or to certain destruction? a breathtaking journey into the heart of darkness werner herzog filmproduktion hessischer rundfunk (hr)"
drama fantasy romance,648,la belle et la bête,"the story of a gentle-hearted beast in love with a simple and beautiful girl. she is drawn to the repellent but strangely fascinating beast, who tests her fidelity by giving her a key, telling her that if she doesn't return it to him by a specific time, he will die of grief. she is unable to return the key on time, but it is revealed that the beast is the genuinely handsome one. a simple tale of tragic love that turns into a surreal vision of death, desire, and beauty.",4.798852,/iYSe3yrkma0e1B0wWPXgr8w5sDN.jpg,"[{'name': 'Discina', 'id': 479}]",1946-10-29,once upon a time,beauty and the beast,7.8,133.0,"['Drama', 'Romance', 'Fantasy']",discina,"beauty and the beast drama fantasy romance the story of a gentle-hearted beast in love with a simple and beautiful girl. she is drawn to the repellent but strangely fascinating beast, who tests her fidelity by giving her a key, telling her that if she doesn't return it to him by a specific time, he will die of grief. she is unable to return the key on time, but it is revealed that the beast is the genuinely handsome one. a simple tale of tragic love that turns into a surreal vision of death, desire, and beauty. once upon a time discina"
drama action war history,616,the last samurai,"nathan algren is an american hired to instruct the japanese army in the ways of modern warfare, which finds him learning to respect the samurai and the honorable principles that rule them. pressed to destroy the samurai's way of life in the name of modernization and open trade, algren decides to become an ultimate warrior himself and to fight for their right to exist.",19.582325,/a8jmJPs5eZBARmnuEEvZwbjwyz4.jpg,"[{'name': 'Cruise/Wagner Productions', 'id': 44}, {'name': 'Warner Bros.', 'id': 6194}, {'name': 'Radar Pictures', 'id': 14718}, {'name': 'Bedford Falls Company, The', 'id': 20634}]",2003-12-05,"in the face of an enemy, in the heart of one man, lies the soul of a warrior.",the last samurai,7.3,1946.0,"['Drama', 'History', 'War', 'Action']","cruise/wagner productions warner bros. radar pictures bedford falls company, the","the last samurai drama action war history nathan algren is an american hired to instruct the japanese army in the ways of modern warfare, which finds him learning to respect the samurai and the honorable principles that rule them. pressed to destroy the samurai's way of life in the name of modernization and open trade, algren decides to become an ultimate warrior himself and to fight for their right to exist. in the face of an enemy, in the heart of one man, lies the soul of a warrior. cruise/wagner productions warner bros. radar pictures bedford falls company, the"
adventure fantasy drama,587,big fish,"throughout his life edward bloom has always been a man of big appetites, enormous passions and tall tales. in his later years, he remains a huge mystery to his son, william. now, to get to know the real man, will begins piecing together a true picture of his father from flashbacks of his amazing adventures.",14.739983,/tjK063yCgaBAluVU72rZ6PKPH2l.jpg,"[{'name': 'Columbia Pictures', 'id': 5}, {'name': 'The Zanuck Company', 'id': 80}, {'name': 'Jinks/Cohen Company', 'id': 2721}, {'name': 'Tim Burton Productions', 'id': 8601}]",2003-12-25,an adventure as big as life itself.,big fish,7.6,2064.0,"['Drama', 'Fantasy', 'Adventure']",columbia pictures the zanuck company jinks/cohen company tim burton productions,"big fish adventure fantasy drama throughout his life edward bloom has always been a man of big appetites, enormous passions and tall tales. in his later years, he remains a huge mystery to his son, william. now, to get to know the real man, will begins piecing together a true picture of his father from flashbacks of his amazing adventures. an adventure as big as life itself. columbia pictures the zanuck company jinks/cohen company tim burton productions"
drama,2289,cold mountain,"in this classic story of love and devotion set against the backdrop of the american civil war, a wounded confederate soldier named w.p. inman deserts his unit and travels across the south, aiming to return to his young wife, ada, who he left behind to tend their farm. as inman makes his perilous journey home, ada struggles to keep their home intact with the assistance of ruby, a mysterious drifter sent to help her by a kindly neighbor.",9.645543,/j0AJeeR5CQPDFh0otyWyCWREHO8.jpg,"[{'name': 'Miramax Films', 'id': 14}, {'name': 'Mirage Enterprises', 'id': 932}, {'name': 'Castel Film Romania', 'id': 1370}, {'name': 'Bona Fide Productions', 'id': 2570}, {'name': 'Cattleya', 'id': 10102}]",2003-12-24,find the strength. find the courage. no matter what it takes... find the way home.,cold mountain,6.7,545.0,['Drama'],miramax films mirage enterprises castel film romania bona fide productions cattleya,"cold mountain drama in this classic story of love and devotion set against the backdrop of the american civil war, a wounded confederate soldier named w.p. inman deserts his unit and travels across the south, aiming to return to his young wife, ada, who he left behind to tend their farm. as inman makes his perilous journey home, ada struggles to keep their home intact with the assistance of ruby, a mysterious drifter sent to help her by a kindly neighbor. find the strength. find the courage. no matter what it takes... find the way home. miramax films mirage enterprises castel film romania bona fide productions cattleya"
