genres,id,original_title,overview,popularity,poster_path,production_companies,release_date,tagline,title,vote_average,vote_count,genres_clean,companies_text,content
horror science fiction,30793,house of dracula,"a scientist working on cures for rare afflictions, such as a bone softening agent made from molds to allow him to correct the spinal deformity of his nurse, finds the physical causes of lycanthropy in wolf-man larry talbot and of vampirism in count dracula, but himself becomes afflicted with homicidal madness while exchanging blood with dracula.",9.074831,/x2HZq0CjGJbU90Q8Bm7jDKBM7ZG.jpg,"[{'name': 'Universal Pictures', 'id': 33}]",1945-12-06,horror upon horror in the house of dracula,house of dracula,5.8,20.0,"['Horror', 'Science Fiction']",universal pictures,"house of dracula horror science fiction a scientist working on cures for rare afflictions, such as a bone softening agent made from molds to allow him to correct the spinal deformity of his nurse, finds the physical causes of lycanthropy in wolf-man larry talbot and of vampirism in count dracula, but himself becomes afflicted with homicidal madness while exchanging blood with dracula. horror upon horror in the house of dracula universal pictures"
romance comedy drama,509,notting hill,the british comedy from director roger michell tells the love story between a famous actress and a simple book seller from london. a look into the attempt for famous people to have a personal and private life and the ramifications that follow. nominated for three golden globes in 2000.,9.874043,/hHRIf2XHeQMbyRb3HUx19SF5Ujw.jpg,"[{'name': 'Bookshop Productions', 'id': 282}, {'name': 'Notting Hill Pictures', 'id': 283}, {'name': 'Working Title Films', 'id': 10163}, {'name': 'Polygram Filmed Entertainment', 'id': 31080}]",1999-05-13,can the most famous film star in the world fall for the man on the street?,notting hill,7.0,1309.0,"['Drama', 'Comedy', 'Romance']",bookshop productions notting hill pictures working title films polygram filmed entertainment,notting hill romance comedy drama the british comedy from director roger michell tells the love story between a famous actress and a simple book seller from london. a look into the attempt for famous people to have a personal and private life and the ramifications that follow. nominated for three golden globes in 2000. can the most famous film star in the world fall for the man on the street? bookshop productions notting hill pictures working title films polygram filmed entertainment
thriller science fiction mystery,1090,the thirteenth floor,"computer scientist hannon fuller has discovered something extremely important. he's about to tell the discovery to his colleague, douglas hall, but knowing someone is after him, the old man leaves a letter in his computer generated parallel world that's just like the 30's with seemingly real people with real emotions.",9.356587,/7oaie3ZBc9UuWZLF24crro1pone.jpg,"[{'name': 'Columbia Pictures', 'id': 5}, {'name': 'Centropolis Film Productions', 'id': 620}]",1999-04-16,question reality. you can go there even though it doesn't exist.,the thirteenth floor,6.8,381.0,"['Thriller', 'Mystery', 'Science Fiction']",columbia pictures centropolis film productions,"the thirteenth floor thriller science fiction mystery computer scientist hannon fuller has discovered something extremely important. he's about to tell the discovery to his colleague, douglas hall, but knowing someone is after him, the old man leaves a letter in his computer generated parallel world that's just like the 30's with seemingly real people with real emotions. question reality. you can go there even though it doesn't exist. columbia pictures centropolis film productions"
action drama thriller,104,lola rennt,"lola receives a phone call from her boyfriend manni. he lost 100,000 dm in a subway train that belongs to a very bad guy. she has 20 minutes to raise this amount and meet manni. otherwise, he will rob a store to get the money. three different alternatives may happen depending on some minor event along lola's run.",7.765379,/v0giIi4bTILVhNhJajet3WWY3FA.jpg,"[{'name': 'X-Filme Creative Pool', 'id': 1972}, {'name': 'Westdeutscher Rundfunk (WDR)', 'id': 7025}]",1998-08-20,every second of every day you're faced with a decision that can change your life.,run lola run,7.2,672.0,"['Thriller', 'Drama', 'Action']",x-filme creative pool westdeutscher rundfunk (wdr),"run lola run action drama thriller lola receives a phone call from her boyfriend manni. he lost 100,000 dm in a subway train that belongs to a very bad guy. she has 20 minutes to raise this amount and meet manni. otherwise, he will rob a store to get the money. three different alternatives may happen depending on some minor event along lola's run. every second of every day you're faced with a decision that can change your life. x-filme creative pool westdeutscher rundfunk (wdr)"
comedy romance,2105,american pie,"at a high-school party, four friends find that losing their collective virginity isn't as easy as they had thought. but they still believe that they need to do so before college. to motivate themselves, they enter a pact to all ""score."" by their senior prom.",18.344227,/5P68by2Thn8wHAziyWGEw2O7hco.jpg,"[{'name': 'Universal Pictures', 'id': 33}, {'name': 'Summit Entertainment', 'id': 491}, {'name': 'Newmarket Capital Group', 'id': 506}, {'name': 'Zide-Perry Productions', 'id': 3169}]",1999-07-09,there's nothing like your first piece.,american pie,6.4,2358.0,"['Comedy', 'Romance']",universal pictures summit entertainment newmarket capital group zide-perry productions,"american pie comedy romance at a high-school party, four friends find that losing their collective virginity isn't as easy as they had thought. but they still believe that they need to do so before college. to motivate themselves, they enter a pact to all ""score."" by their senior prom. there's nothing like your first piece. universal pictures summit entertainment newmarket capital group zide-perry productions"
drama thriller mystery,1073,arlington road,threats from sinister foreign nationals aren't the only thing to fear. bedraggled college professor michael faraday has been vexed (and increasingly paranoid) since his wife's accidental death in a botched fbi operation. but all that takes a backseat when a seemingly all-american couple set up house next door.,8.605659,/4yYHyZuyTTQaEZuHKS7561jXjtR.jpg,"[{'name': 'Lakeshore Entertainment', 'id': 126}, {'name': 'Screen Gems', 'id': 3287}, {'name': 'Arlington Road Productions Corporation', 'id': 22512}, {'name': 'Gorai / Samuelson Productions', 'id': 22513}, {'name': 'Samuelson Productions', 'id': 22514}]",1999-03-19,your paranoia is real.,arlington road,7.0,246.0,"['Thriller', 'Drama', 'Mystery']",lakeshore entertainment screen gems arlington road productions corporation gorai / samuelson productions samuelson productions,arlington road drama thriller mystery threats from sinister foreign nationals aren't the only thing to fear. bedraggled college professor michael faraday has been vexed (and increasingly paranoid) since his wife's accidental death in a botched fbi operation. but all that takes a backseat when a seemingly all-american couple set up house next door. your paranoia is real. lakeshore entertainment screen gems arlington road productions corporation gorai / samuelson productions samuelson productions
mystery drama,345,eyes wide shut,"after dr. bill hartford's wife, alice, admits to having sexual fantasies about a man she met, bill becomes obsessed with having a sexual encounter. he discovers an underground sexual group and attends one of their meetings -- and quickly discovers that he is in over his head.",13.268484,/knEIz1eNGl5MQDbrEAVWA7iRqF9.jpg,"[{'name': 'Hobby Films', 'id': 194}, {'name': 'Pole Star', 'id': 195}, {'name': 'Stanley Kubrick Productions', 'id': 385}, {'name': 'Warner Bros.', 'id': 6194}]",1999-07-14,cruise. kidman. kubrick.,eyes wide shut,7.1,1266.0,"['Drama', 'Mystery']",hobby films pole star stanley kubrick productions warner bros.,"eyes wide shut mystery drama after dr. bill hartford's wife, alice, admits to having sexual fantasies about a man she met, bill becomes obsessed with having a sexual encounter. he discovers an underground sexual group and attends one of their meetings -- and quickly discovers that he is in over his head. cruise. kidman. kubrick. hobby films pole star stanley kubrick productions warner bros."
drama action thriller crime,247,the killing,the killing was stanley kubrick’s first film with a professional cast and the first time he achieved public recognition as the unconventional director he’s now known for. the story is of ex-prisoners who plan to set up a racetrack so they can live a life without monetary worries. one of the more exceptional films of the 1950’s.,10.223264,/A6VzUPcADZGYdGHlVdWvpMNDF5d.jpg,"[{'name': 'United Artists', 'id': 60}, {'name': 'Harris-Kubrick Productions', 'id': 52795}]",1956-05-08,"...like no other picture since ""scarface"" and ""little caesar""!",the killing,7.7,290.0,"['Thriller', 'Drama', 'Crime', 'Action']",united artists harris-kubrick productions,"the killing drama action thriller crime the killing was stanley kubrick’s first film with a professional cast and the first time he achieved public recognition as the unconventional director he’s now known for. the story is of ex-prisoners who plan to set up a racetrack so they can live a life without monetary worries. one of the more exceptional films of the 1950’s. ...like no other picture since ""scarface"" and ""little caesar""! united artists harris-kubrick productions"
drama romance,802,lolita,"humbert humbert is a middle-aged british novelist who is both appalled by and attracted to the vulgarity of american culture. when he comes to stay at the boarding house run by charlotte haze, he soon becomes obsessed with lolita, the woman's teenaged daughter.",9.551293,/8Puqbeh0D95DpXFWep1rmH78btu.jpg,"[{'name': 'Seven Arts Productions', 'id': 516}, {'name': 'Allied Artists', 'id': 517}, {'name': 'Transworld Pictures', 'id': 518}]",1962-06-13,how did they ever make a movie of ...,lolita,7.3,409.0,"['Drama', 'Romance']",seven arts productions allied artists transworld pictures,"lolita drama romance humbert humbert is a middle-aged british novelist who is both appalled by and attracted to the vulgarity of american culture. when he comes to stay at the boarding house run by charlotte haze, he soon becomes obsessed with lolita, the woman's teenaged daughter. how did they ever make a movie of ... seven arts productions allied artists transworld pictures"
drama romance war,3175,barry lyndon,"in the eighteenth century, in a small village in ireland, redmond barry is a young farm boy in love with his cousin nora brady. when nora engages to the british captain john quin, barry challenges him for a duel of pistols. he wins and escapes to dublin, but is robbed on the road. without any other alternative, barry joins the british army to fight in the seven years war.",14.003467,/x2JQCgLjieWOwvImeGtLmuNgsrq.jpg,"[{'name': 'Hawk Films', 'id': 88}, {'name': 'Warner Bros.', 'id': 6194}, {'name': 'Peregrine', 'id': 11272}]",1975-12-18,at long last redmond barry became a gentleman - and that was his tragedy.,barry lyndon,7.7,521.0,"['Drama', 'War', 'Romance']",hawk films warner bros. peregrine,"barry lyndon drama romance war in the eighteenth century, in a small village in ireland, redmond barry is a young farm boy in love with his cousin nora brady. when nora engages to the british captain john quin, barry challenges him for a duel of pistols. he wins and escapes to dublin, but is robbed on the road. without any other alternative, barry joins the british army to fight in the seven years war. at long last redmond barry became a gentleman - and that was his tragedy. hawk films warner bros. peregrine"
music drama,2115,light of day,"fox and jett play a brother and sister who are lead performers in a rock band, the barbusters, in cleveland, ohio. the sister, patti rasnick, is an unmarried mother and has a troubled relationship with her own mother, who is deeply religious. estranged from her parents and struggling to make ends meet, patti decides to dive headlong into a carefree rock music lifestyle. the brother, joe rasnick, pulls away from rock music to provide some stability for his young nephew. it takes a family crisis to bring patti back home and force her to face the prickly past with her mother.",1.745096,/hFXnASDyZd3i9TOuBPUtJRvfZsK.jpg,"[{'name': 'Keith Barish Productions', 'id': 964}, {'name': 'TAFT Entertainment Pictures', 'id': 965}, {'name': 'Home Box Office (HBO)', 'id': 3268}]",1987-02-06,,light of day,5.4,10.0,"['Drama', 'Music']",keith barish productions taft entertainment pictures home box office (hbo),"light of day music drama fox and jett play a brother and sister who are lead performers in a rock band, the barbusters, in cleveland, ohio. the sister, patti rasnick, is an unmarried mother and has a troubled relationship with her own mother, who is deeply religious. estranged from her parents and struggling to make ends meet, patti decides to dive headlong into a carefree rock music lifestyle. the brother, joe rasnick, pulls away from rock music to provide some stability for his young nephew. it takes a family crisis to bring patti back home and force her to face the prickly past with her mother.  keith barish productions taft entertainment pictures home box office (hbo)"
mystery thriller drama,745,the sixth sense,"a psychological thriller about an eight year old boy named cole sear who believes he can see into the world of the dead. a child psychologist named malcolm crowe comes to cole to help him deal with his problem, learning that he really can see ghosts of dead people.",18.449169,/vOyfUXNFSnaTk7Vk5AjpsKTUWsu.jpg,"[{'name': 'Spyglass Entertainment', 'id': 158}, {'name': 'The Kennedy/Marshall Company', 'id': 862}, {'name': 'Hollywood Pictures', 'id': 915}, {'name': 'Barry Mendel Productions', 'id': 17032}]",1999-08-06,not every gift is a blessing.,the sixth sense,7.7,3223.0,"['Thriller', 'Drama', 'Mystery']",spyglass entertainment the kennedy/marshall company hollywood pictures barry mendel productions,"the sixth sense mystery thriller drama a psychological thriller about an eight year old boy named cole sear who believes he can see into the world of the dead. a child psychologist named malcolm crowe comes to cole to help him deal with his problem, learning that he really can see ghosts of dead people. not every gift is a blessing. spyglass entertainment the kennedy/marshall company hollywood pictures barry mendel productions"
drama crime romance,913,the thomas crown affair,"a very rich and successful playboy amuses himself by stealing artwork, but may have met his match in a seductive detective.",10.961226,/5yqs1MVlqdIg1DY5adC5jFx3d7j.jpg,"[{'name': 'Irish Dreamtime', 'id': 597}, {'name': 'Metro-Goldwyn-Mayer (MGM)', 'id': 8411}]",1999-08-06,how do you get the man who has everything?,the thomas crown affair,6.7,349.0,"['Drama', 'Crime', 'Romance']",irish dreamtime metro-goldwyn-mayer (mgm),"the thomas crown affair drama crime romance a very rich and successful playboy amuses himself by stealing artwork, but may have met his match in a seductive detective. how do you get the man who has everything? irish dreamtime metro-goldwyn-mayer (mgm)"
romance crime thriller drama,912,the thomas crown affair,"young businessman, thomas crown is bored and decides to plan a robbery and assigns a professional agent with the right information to the job. however, crown is soon betrayed yet cannot blow his cover because he’s in love.",9.444818,/oODAwa2AK3fXvK93GCbq7dFLZPi.jpg,"[{'name': 'The Mirisch Corporation', 'id': 219}, {'name': 'Solar Productions', 'id': 599}, {'name': 'Simkoe', 'id': 16749}]",1968-06-19,,the thomas crown affair,6.9,95.0,"['Thriller', 'Drama', 'Crime', 'Romance']",the mirisch corporation solar productions simkoe,"the thomas crown affair romance crime thriller drama young businessman, thomas crown is bored and decides to plan a robbery and assigns a professional agent with the right information to the job. however, crown is soon betrayed yet cannot blow his cover because he’s in love.  the mirisch corporation solar productions simkoe"
comedy romance,6373,"martha – meet frank, daniel and laurence","laurence recounts to his neighbour how his life long friendship with frank and daniel has been overturned in just three days by their each independently meeting, and falling for, martha, who has no idea of their connection. slowly the tale unfolds, the narrative moving backwards and forwards gradually filling in the gaps until we see the whole picture",1.233052,/5BdJ9K9NGpbCSmjIZpuZJgMf4ie.jpg,"[{'name': 'Channel Four Films', 'id': 181}, {'name': 'Banshee', 'id': 2079}]",1998-05-08,two's company. three's a crowd. four's a disaster.,the very thought of you,5.0,11.0,"['Comedy', 'Romance']",channel four films banshee,"the very thought of you comedy romance laurence recounts to his neighbour how his life long friendship with frank and daniel has been overturned in just three days by their each independently meeting, and falling for, martha, who has no idea of their connection. slowly the tale unfolds, the narrative moving backwards and forwards gradually filling in the gaps until we see the whole picture two's company. three's a crowd. four's a disaster. channel four films banshee"
comedy romance,1610,fever pitch,"a romantic comedy about a man, a woman and a football team. based on nick hornby's best selling autobiographical novel, fever pitch. english teacher paul ashworth believes his long standing obsession with arsenal serves him well. but then he meets sarah. their relationship develops in tandem with arsenal's roller coaster fortunes in the football league, both leading to a nail biting climax.",6.906939,/xTpZGWVo5DDk1oQUrUJcRjqGzGg.jpg,"[{'name': 'Scala Productions', 'id': 1261}, {'name': 'Wildgaze Films', 'id': 1508}]",1997-04-04,life gets complicated when you love one woman and worship eleven men,fever pitch,6.1,53.0,"['Comedy', 'Romance']",scala productions wildgaze films,"fever pitch comedy romance a romantic comedy about a man, a woman and a football team. based on nick hornby's best selling autobiographical novel, fever pitch. english teacher paul ashworth believes his long standing obsession with arsenal serves him well. but then he meets sarah. their relationship develops in tandem with arsenal's roller coaster fortunes in the football league, both leading to a nail biting climax. life gets complicated when you love one woman and worship eleven men scala productions wildgaze films"
adventure action thriller,253,live and let die,james bond must investigate a mysterious murder case of a british agent in new orleans. soon he finds himself up against a gangster boss named mr. big.,9.773768,/39qkrjqMZs6utwNmihVImC3ghas.jpg,"[{'name': 'United Artists', 'id': 60}, {'name': 'Eon Productions', 'id': 7576}, {'name': 'Danjaq', 'id': 10761}]",1973-07-05,roger moore is james bond.,live and let die,6.4,540.0,"['Thriller', 'Action', 'Adventure']",united artists eon productions danjaq,live and let die adventure action thriller james bond must investigate a mysterious murder case of a british agent in new orleans. soon he finds himself up against a gangster boss named mr. big. roger moore is james bond. united artists eon productions danjaq
drama,596,the grapes of wrath,"tom joad returns to his home after a jail sentence to find his family kicked out of their farm due to foreclosure. he catches up with them on his uncles farm, and joins them the next day as they head for california and a new life... hopefully.",9.668636,/eUcxMVBIA0Jg8l1RGUqycrc3eIQ.jpg,"[{'name': 'Twentieth Century Fox Film Corporation', 'id': 306}]",1940-03-15,the most discussed book in years - now comes to the screen to become the most discussed picture in ages,the grapes of wrath,7.8,211.0,['Drama'],twentieth century fox film corporation,"the grapes of wrath drama tom joad returns to his home after a jail sentence to find his family kicked out of their farm due to foreclosure. he catches up with them on his uncles farm, and joins them the next day as they head for california and a new life... hopefully. the most discussed book in years - now comes to the screen to become the most discussed picture in ages twentieth century fox film corporation"
drama,293,a river runs through it,"a river runs through is a cinematographically stunning true story of norman maclean. the story follows norman and his brother paul through the experiences of life and growing up, and how their love of fly fishing keeps them together despite varying life circumstances in the untamed west of montana in the 1920's.",12.583826,/aVP45oS2cBL4WtZ1kB7r8uarruB.jpg,"[{'name': 'Columbia Pictures', 'id': 5}]",1992-10-09,the story of an american family.,a river runs through it,7.0,241.0,['Drama'],columbia pictures,"a river runs through it drama a river runs through is a cinematographically stunning true story of norman maclean. the story follows norman and his brother paul through the experiences of life and growing up, and how their love of fly fishing keeps them together despite varying life circumstances in the untamed west of montana in the 1920's. the story of an american family. columbia pictures"
fantasy drama crime,497,the green mile,"a supernatural tale set on death row in a southern prison, where gentle giant john coffey possesses the mysterious power to heal people's ailments. when the cellblock's head guard, paul edgecomb, recognizes coffey's miraculous gift, he tries desperately to help stave off the condemned man's execution.",19.96678,/o0lO84GI7qrG6XFvtsPOSV7CTNa.jpg,"[{'name': 'Castle Rock Entertainment', 'id': 97}, {'name': 'Darkwoods Productions', 'id': 3982}, {'name': 'Warner Bros.', 'id': 6194}]",1999-12-10,miracles do happen.,the green mile,8.2,4166.0,"['Drama', 'Crime', 'Fantasy']",castle rock entertainment darkwoods productions warner bros.,"the green mile fantasy drama crime a supernatural tale set on death row in a southern prison, where gentle giant john coffey possesses the mysterious power to heal people's ailments. when the cellblock's head guard, paul edgecomb, recognizes coffey's miraculous gift, he tries desperately to help stave off the condemned man's execution. miracles do happen. castle rock entertainment darkwoods productions warner bros."
comedy family science fiction,926,galaxy quest,"the stars of a 1970s sci-fi show - now scraping a living through re-runs and sci-fi conventions - are beamed aboard an alien spacecraft. believing the cast's heroic on-screen dramas are historical documents of real-life adventures, the band of aliens turn to the ailing celebrities for help in their quest to overcome the oppressive regime in their solar system.",15.831374,/fZXSwgZknp81vmciTb86rw0MejV.jpg,"[{'name': 'DreamWorks SKG', 'id': 27}, {'name': 'Gran Via Productions', 'id': 2605}]",1999-12-23,a comedy of galactic proportions.,galaxy quest,6.9,722.0,"['Comedy', 'Family', 'Science Fiction']",dreamworks skg gran via productions,"galaxy quest comedy family science fiction the stars of a 1970s sci-fi show - now scraping a living through re-runs and sci-fi conventions - are beamed aboard an alien spacecraft. believing the cast's heroic on-screen dramas are historical documents of real-life adventures, the band of aliens turn to the ailing celebrities for help in their quest to overcome the oppressive regime in their solar system. a comedy of galactic proportions. dreamworks skg gran via productions"
thriller crime drama,1213,the talented mr. ripley,"tom ripley is a calculating young man who believes it's better to be a fake somebody than a real nobody. opportunity knocks in the form of a wealthy u.s. shipbuilder who hires tom to travel to italy to bring back his playboy son, dickie. ripley worms his way into the idyllic lives of dickie and his girlfriend, plunging into a daring scheme of duplicity, lies and murder.",11.65502,/6ojHgqtIR41O2qLKa7LFUVj0cZa.jpg,"[{'name': 'Paramount Pictures', 'id': 4}, {'name': 'Miramax Films', 'id': 14}, {'name': 'Timnick Films', 'id': 679}, {'name': 'Mirage Enterprises', 'id': 932}]",1999-12-25,how far would you go to become someone else?,the talented mr. ripley,7.1,790.0,"['Thriller', 'Drama', 'Crime']",paramount pictures miramax films timnick films mirage enterprises,"the talented mr. ripley thriller crime drama tom ripley is a calculating young man who believes it's better to be a fake somebody than a real nobody. opportunity knocks in the form of a wealthy u.s. shipbuilder who hires tom to travel to italy to bring back his playboy son, dickie. ripley worms his way into the idyllic lives of dickie and his girlfriend, plunging into a daring scheme of duplicity, lies and murder. how far would you go to become someone else? paramount pictures miramax films timnick films mirage enterprises"
